{
  "skill": "qveris-alphaear-market-intelligence-direct",
  "source_record": {
    "candidate_number": 42,
    "original_repository": "Awesome Finance Skills / AlphaEar",
    "github_url": "https://github.com/RKiding/Awesome-finance-skills",
    "license": "Apache-2.0",
    "evaluation_recent_activity": "2026-03-29",
    "local_source_snapshot": "third_party/source_repos/42-awesome-finance-skills",
    "snapshot_latest_commit": "853f09b on 2026-03-29"
  },
  "controls": {
    "dry_run": true,
    "max_calls": 0,
    "max_age": "P1D",
    "budget_note": "No direct QVeris request is allowed."
  },
  "analysis": {
    "fixture_scope": "static_schema_example",
    "workflow": "budget_limited_market_intelligence",
    "report_mode": "coverage_monitor",
    "summary": "No request was made because max_calls is zero; no market-intelligence conclusion is supported.",
    "next_queries": [
      "listed security identity and company profile lookup API",
      "real-time stock quote and historical price bars API"
    ]
  },
  "risk_notes": [
    "Budget-limited output cannot validate issuer identity, news, sentiment, fundamentals, or market data."
  ],
  "missing_fields": [
    "issuer_identity",
    "market_data",
    "fundamentals",
    "news_context",
    "sentiment",
    "signal_monitoring_evidence"
  ],
  "data_quality": {
    "status": "budget_limited",
    "warnings": [
      "not_called_due_to_max_calls",
      "static_fixture_not_observed"
    ],
    "stale_fields": [],
    "out_of_window_events": [],
    "suppressed_fields": [
      "forecast",
      "target_price",
      "buy_sell"
    ]
  },
  "observed_call_count": 0,
  "qveris_trace": [],
  "disclaimer": "Not investment advice.",
  "suppressed_fields": [
    "forecast",
    "target_price",
    "buy_sell"
  ]
}
